Work Item Type,Title,Description,Tags,Effort,Risk
User Story,"Rebuild: AIFLeadToCashSync","Legacy integrations usually need redesign for D365FO operations and monitoring. Target: OData, custom service, Business Events, or middleware","AXMigration;integration;aif;overlayering",11,High
User Story,"Rebuild: DataverseCustomerExport","Legacy integrations usually need redesign for D365FO operations and monitoring. Target: Data entity, export, reporting replica, or data lake pattern","AXMigration;integration;direct-sql;overlayering",11,High
User Story,"Rebuild: CustContactLegacyMap","Unsupported legacy dependency detected. Target: Extension/service/data entity redesign","AXMigration;data;direct-sql;overlayering",8,Medium
User Story,"Extend: OpportunityQuoteBridge","Customization likely needs extension-based migration. Target: Chain of Command or event handler","AXMigration;object;overlayering",8,Medium
User Story,"Standard / Power BI Review: PipelineConversionLegacy","Reports should be rationalized before rebuild. Target: D365FO workspace, SSRS, Power BI, Financial Reporter, or archive","AXMigration;report;overlayering;report-rationalization",7,Medium
User Story,"Map: SalesManagerLegacyRole","Security must be mapped rather than technically migrated as-is. Target: D365FO roles, duties, privileges, and SoD review","AXMigration;security;overlayering",5,Medium
